{
  "$schema": "https://json-schema.org/draft/2020-12/schema",
  "$id": "https://foothold.local/schemas/sources.schema.json",
  "title": "Foothold source records (data/processed/sources.json and data/processed/sources/*.json)",
  "type": "array",
  "items": {
    "type": "object",
    "required": [
      "id",
      "title",
      "url",
      "publisher",
      "license",
      "retrieved",
      "status"
    ],
    "properties": {
      "id": {
        "type": "string",
        "pattern": "^[a-z][a-z0-9_]*$"
      },
      "title": {
        "type": "string",
        "minLength": 1
      },
      "url": {
        "type": "string",
        "minLength": 1
      },
      "publisher": {
        "type": "string",
        "minLength": 1
      },
      "license": {
        "type": "string",
        "minLength": 1
      },
      "retrieved": {
        "type": [
          "string",
          "null"
        ]
      },
      "status": {
        "enum": [
          "REAL",
          "SAMPLE",
          "SYNTHETIC",
          "FICTIONAL"
        ]
      },
      "attribution": {
        "type": "string"
      },
      "notes": {
        "type": [
          "string",
          "array"
        ]
      },
      "used_by": {
        "type": "array",
        "items": {
          "type": "string"
        }
      }
    }
  }
}
